[
  {
    "id": "gse277292_dapp1",
    "aliases": ["GSE277292", "WTKO"],
    "studyGroup": "dapp1_lsk",
    "modality": "scrna",
    "scale": "10k_50k",
    "topology": "unknown",
    "priors": { "labels": true, "perturbation": true },
    "perturbation": true
  },
  {
    "id": "gse278673_radiation",
    "aliases": ["GSE278673", "IRALL"],
    "studyGroup": "radiation_lsk",
    "modality": "scrna",
    "scale": "10k_50k",
    "topology": "unknown",
    "priors": { "labels": false, "perturbation": true },
    "perturbation": true
  },
  {
    "id": "gse280270_ucb_tpo",
    "aliases": ["GSE280270"],
    "studyGroup": "ucb_tpo_holdout",
    "modality": "scrna",
    "scale": "unknown",
    "topology": "linear",
    "priors": { "time": true },
    "perturbation": true
  },
  {
    "id": "gse280145_sleep_deprivation",
    "aliases": ["GSE280145"],
    "studyGroup": "sleep_deprivation",
    "modality": "scrna",
    "scale": "unknown",
    "topology": "unknown",
    "priors": { "perturbation": true },
    "perturbation": true
  },
  {
    "id": "s_subs8_cd34",
    "aliases": ["S-SUBS8"],
    "studyGroup": "cd34_hspc",
    "modality": "scrna",
    "scale": "lt_10k",
    "topology": "multibranch",
    "priors": { "labels": true, "root_state": true },
    "perturbation": false
  },
  {
    "id": "gse132188_endo",
    "aliases": ["GSE132188"],
    "studyGroup": "pancreas_endo",
    "modality": "scrna",
    "scale": "lt_10k",
    "topology": "multibranch",
    "priors": { "labels": true, "root_state": true },
    "perturbation": false
  },
  {
    "id": "gse117498_pheno_hsc",
    "aliases": ["GSE117498"],
    "studyGroup": "pheno_hsc",
    "modality": "scrna",
    "scale": "unknown",
    "topology": "unknown",
    "priors": { "labels": true },
    "perturbation": false
  },
  {
    "id": "ccvgae_endo",
    "aliases": ["endo"],
    "studyGroup": "ccvgae_endo",
    "modality": "scrna",
    "scale": "lt_10k",
    "topology": "unknown",
    "priors": {},
    "perturbation": false
  },
  {
    "id": "ccvgae_setty",
    "aliases": ["setty"],
    "studyGroup": "ccvgae_setty",
    "modality": "scrna",
    "scale": "lt_10k",
    "topology": "unknown",
    "priors": {},
    "perturbation": false
  },
  {
    "id": "ccvgae_hesc",
    "aliases": ["hESC"],
    "studyGroup": "ccvgae_hesc",
    "modality": "scrna",
    "scale": "lt_10k",
    "topology": "unknown",
    "priors": {},
    "perturbation": false
  },
  {
    "id": "ccvgae_blood_aged",
    "aliases": ["bloodAged"],
    "studyGroup": "ccvgae_blood_aged",
    "modality": "scrna",
    "scale": "10k_50k",
    "topology": "unknown",
    "priors": {},
    "perturbation": false
  },
  {
    "id": "ccvgae_hemato",
    "aliases": ["hemato"],
    "studyGroup": "ccvgae_hemato",
    "modality": "scrna",
    "scale": "10k_50k",
    "topology": "unknown",
    "priors": {},
    "perturbation": false
  },
  {
    "id": "gsm5124061",
    "aliases": [],
    "studyGroup": "gsm5124061",
    "modality": "scatac",
    "scale": "lt_10k",
    "topology": "unknown",
    "priors": {},
    "perturbation": false
  },
  {
    "id": "gse198730",
    "aliases": [],
    "studyGroup": "gse198730",
    "modality": "scatac",
    "scale": "lt_10k",
    "topology": "unknown",
    "priors": {},
    "perturbation": false
  },
  {
    "id": "gsm6638254",
    "aliases": [],
    "studyGroup": "gsm6638254",
    "modality": "scatac",
    "scale": "lt_10k",
    "topology": "unknown",
    "priors": {},
    "perturbation": false
  },
  {
    "id": "gsm7308367",
    "aliases": [],
    "studyGroup": "gsm7308367",
    "modality": "scatac",
    "scale": "10k_50k",
    "topology": "unknown",
    "priors": {},
    "perturbation": false
  },
  {
    "id": "gse206767",
    "aliases": [],
    "studyGroup": "gse206767",
    "modality": "scatac",
    "scale": "10k_50k",
    "topology": "unknown",
    "priors": {},
    "perturbation": false
  }
]
